{
  "$schema": "http://json-schema.org/draft-07/schema#",
  "title": "openrouter.decisions.response.v1",
  "description": "Verified wire format returned by POST https://openrouter.ai/api/alpha/decisions on HTTP 200, per docs/PI/pi_jev_m0_provider_protocol_de.md section 1 (real response captured 2026-09-22, content redacted/synthetic). Untrusted input: decisionsService.ts must validate against this schema and reject anything else BEFORE constructing a pi.decisions.response.v1 -- an unknown answer type, a non-finite probability, or an extra field is a hard rejection, not a best-effort parse.",
  "type": "object",
  "required": ["model", "answers", "usage", "id", "provider"],
  "additionalProperties": false,
  "properties": {
    "model": {
      "type": "string",
      "description": "The actually-processing model build, e.g. \"typesafe/jev-1.13-20260917\" -- OpenRouter appends its own date-stamped build suffix; this is NOT the same format as TypeSafe's own pinned jev-1.13.0. Maps to pi.decisions.response.v1.model_reported verbatim, format differences and all."
    },
    "answers": {
      "type": "object",
      "additionalProperties": {"$ref": "#/definitions/answer"}
    },
    "usage": {
      "type": "object",
      "required": ["input_tokens", "output_tokens", "cost"],
      "additionalProperties": false,
      "properties": {
        "input_tokens": {"type": "integer", "minimum": 0},
        "output_tokens": {"type": "integer", "minimum": 0},
        "cost": {"type": "number", "minimum": 0, "description": "USD, per-call cost as billed by OpenRouter. Not present on the TypeSafe-direct API's usage object; log this for M3's cost-visibility concern."}
      }
    },
    "id": {
      "type": "string",
      "pattern": "^gen-dec-",
      "description": "OpenRouter generation id for this decisions call."
    },
    "provider": {
      "type": "string",
      "description": "Upstream provider name as disclosed by OpenRouter, e.g. \"TypeSafe\"."
    }
  },
  "definitions": {
    "answer": {
      "oneOf": [
        {"$ref": "#/definitions/choiceAnswer"},
        {"$ref": "#/definitions/noulAnswer"},
        {"$ref": "#/definitions/scoreAnswer"}
      ]
    },
    "choiceAnswer": {
      "type": "object",
      "required": ["type", "choice", "probabilities", "confidence"],
      "additionalProperties": false,
      "properties": {
        "type": {"const": "choice"},
        "choice": {"type": "string", "minLength": 1},
        "probabilities": {
          "type": "object",
          "additionalProperties": {"type": "number", "minimum": 0, "maximum": 1},
          "description": "Every value MUST be finite and in [0,1]; a NaN/Infinity anywhere rejects the whole response."
        },
        "confidence": {"type": "number", "minimum": 0, "maximum": 1}
      }
    },
    "noulAnswer": {
      "type": "object",
      "required": ["type", "noul", "confidence"],
      "additionalProperties": false,
      "properties": {
        "type": {"const": "noul"},
        "noul": {"type": "number", "minimum": 0, "maximum": 1},
        "confidence": {"type": "number", "minimum": 0, "maximum": 1}
      },
      "description": "Not empirically verified against this endpoint yet (pi_jev_m0_provider_protocol_de.md section 6); shape carried over from the TypeSafe primitive contract."
    },
    "scoreAnswer": {
      "type": "object",
      "required": ["type", "score", "legend", "confidence"],
      "additionalProperties": false,
      "properties": {
        "type": {"const": "score"},
        "score": {"type": "number"},
        "legend": {"type": "object", "additionalProperties": {"type": "string"}},
        "confidence": {"type": "number", "minimum": 0, "maximum": 1}
      },
      "description": "Not used by this project; not empirically verified against this endpoint."
    }
  }
}
