{
  "model": "typesafe/jev-1.13-20260917",
  "answers": {
    "candidate_selection": {
      "type": "choice",
      "choice": "keep_current",
      "probabilities": {
        "keep_current": 0.61,
        "insufficient_evidence": 0.27,
        "enable_adaptive_weights": 0.12
      },
      "confidence": 0.61
    }
  },
  "usage": {"input_tokens": 412, "output_tokens": 9, "cost": 0.0000147},
  "id": "gen-dec-0000000000-SyntheticFixtureId00",
  "provider": "TypeSafe"
}
